{
  "schema_version": "completion-evidence/v1",
  "generated_at": "",
  "source_request": "",
  "evidence_action": "<command or check performed>",
  "result": {
    "status": "not_run",
    "summary": "<result or exit status summary>",
    "exit_code": null
  },
  "covered_scope": [
    "<what the evidence directly covers>"
  ],
  "uncovered_scope": [
    "<uncovered scope, or none>"
  ],
  "residual_risk": [
    "<residual risk, or none>"
  ],
  "confidence_grade": "C",
  "evidence_refs": [
    "<test output, report, ledger, artifact, or command transcript>"
  ]
}
